[
  { "schoolId": "10487", "majorCode": "081200", "type": "trend_reason", "content": "2024年学硕线370分（第三方整理），处于高位；2023/2025为示例数据，待官网核验后更新原因分析。", "source": "人工标注" },
  { "schoolId": "10487", "majorCode": null, "type": "school_review", "content": "示例：工科强校，就业导向强，华中地区计算机首选之一；复试重视机试与项目。", "source": "学生口碑示例" },
  { "schoolId": "10486", "majorCode": "081200", "type": "trend_reason", "content": "2025年学校基本线学硕325/专硕320；注意各学院可二次划线，实际院线可能更高，以学院通知为准。", "source": "武汉大学2025复试基本分数线（研招网）" },
  { "schoolId": "10486", "majorCode": null, "type": "school_review", "content": "示例：综合声誉好，武汉区位优，跨考友好度中等，复试公平性口碑较好。", "source": "学生口碑示例" }
]
